Claim,Evidence,Label,Date,URL
Photo shows Obi drinking beer which has a Biafran trademark.,"Findings by The FactCheckHub show that the image has been distorted. Hero beer is a popular beer launched in 2012 and brewed in Onitsha, Anambra state in South-Eastern Nigeria. Each beer bottle has an 11-pointed star which beams yellow, orange, and red placed upon a dark green which appears similar to the symbol of proscribed Indigenous Peoples of Biafra (IPOB), a secessionist group. A closer look at the image shows some distortion around Peter Obi’s neck indicating that his head was doctored in the photo and the beer bottles on the table also appear photo-shopped. A Google Reverse Image search on the internet shows that the original picture was tweeted online by one Twitter user, @Jaiynaija, on the 23rd of January, 2023 before it was photo-shopped and later tweeted by Adamu Garba the following day.",FALSE,29-01-2023,https://factcheckhub.com/adamu-garba-shares-doctored-image-of-peter-obi-with-alcoholic-drink/
Sowore authored quotes praising Peter Obi for being a humble man.,"Findings by FactCheckHub show that the quote was fabricated. The FactCheckHub observed that none of the social media users who posted the texts referenced their source(s) publicly, thus raising a red flag. Also, a keyword search on Google Search did not reveal anywhere or when Sowore made the statement. Moreover, no credible media organisation in the country reported the quote attributed to Sowore. When the FactCheckHub contacted Sowore via WhatsApp, he disowned the viral quote and affirmed that it’s “FALSE”. Sowore further also disowned it via his Twitter handle. I never made any utterance(s) attributed to me here by @UzomaPreciousF1 about @PeterObi! #WeCantContinueLikeThis pic.twitter.com/s2itNbspgb — Omoyele Sowore (@YeleSowore) January 23, 2023",FALSE,28-01-2023,https://factcheckhub.com/fake-quote-attributed-to-sowore-applauding-peter-obi-circulates-online/
"No Yoruba woman has bore the title of First Lady in Nigerian Presidency.
","Findings by The FactCheckHub show that the claim is FALSE. Since 1963, during the administration of the country’s first president, Nnamdi Azikwe till date, Nigeria has had 15 First Ladies in the Presidency. They include: Flora Azikiwe (1963-1966), Victoria Aguiyi-Ironsi (1966-1966), Victoria Gowon (1966-1975), Ajoke Muhammed (1975-1976), Esther Oluremi Obasanjo (1976-1979, Hadiza Shehu Shagari (1979-1983), Safinatu Buhari (1983-1985), and Maryam Babangida (1985-1993). Others are Margaret Shonekan (1993), Maryam Abacha (1993-1998), Fati Lami Abubakar (1998-1999), Stella Obasanjo (1999-2005), Turai Yar’Adua (2007-2010), Patience Jonathan (2010-2015), and Aisha Muhammadu Buhari (2015 till date). In the last 59 years, Nigeria has had at least three First Ladies from the Yoruba ethnic group. The Yorubas among the past First Ladies include Ajoke Muhammad, wife of the (late) General Muritala Muhammad; Esther Oluremi Obasanjo, wife of Chief Olusegun Obasanjo (now ex-wife); and Margaret Shonekan, wife of the (late) Chief Earnest Shonekan. This shows that 2023 would not be the first time that Nigeria will be having a Yoruba First Lady, contrary to the claim by Atiku’s wife, Titi.",FALSE,27-01-2023,https://factcheckhub.com/atikus-wife-titi-abubakar-makes-false-claim-about-the-office-of-nigerias-first-lady/
"Sanusi authored a quote saying North is not the problem of Nigeria but tribalism.
","Findings by The FactCheckHub show that the quote was fabricated. Further checks revealed that the quote started making round on internet since two weeks ago as seen here and here. However, the FactCheckHub observed that none of the social media users who posted the same quote disclosed their source(s) publicly, thus raising a red flag. Also, a keyword search on Google did not reveal anywhere or when the former Emir made the statement. Moreover, no credible media organisation in Nigeria reported the quote attributed to Sanusi. This is not the first time a false quote would be attributed to Sanusi. For instance, the FactCheckHub had earlier debunked a quote attributed to him, where he was purportedly analyzing the uniqueness of at least three presidential candidates contesting Nigeria’s 2023 election. When contacted, Imam Murtala Gusau, a regular Islamic columnist and a close friend of Sanusi confirmed to FactCheckHub that the quote was not from the former Emir. Charly Boy is a regular purveyor of disinformation who has been fact-checked several times by The FactCheckHub. He wields strong influence online and has over 185,000 followers on Twitter. For instance, the FactCheckHub had earlier reported how he shared a misleading video with a claim that it showed Peter Obi’s supporters in boats holding a campaign rally in riverine areas. The FactCheckHub also reported how he made a false claim about the electronic transmission of election results by the Independent National Electoral Commission (INEC). He also tweeted a misleading photo showing the presidential candidate of the All Progressives Congress (APC), Bola Ahmed Tinubu, watching Peter Obi, on a television screen in an aircraft.",FALSE,21-01-2023,https://factcheckhub.com/charly-boy-shares-fake-quote-attributed-to-sanusi/
63 per cent of Nigeria’s population lives in poverty.,"According to a recent report by the National Bureau of Statistics (NBS) on multi-dimensional poverty, about 133 million people in Nigeria, representing 63 per cent of the population, are living in different categories of poverty. The report stated that 65 per cent of the poor (86 million people) live in Northern Nigeria, while 35 per cent (nearly 47 million) live in the South. The National Multi-Dimensional Poverty Index (MPI) report is 0.257, indicating that poor people in Nigeria experience just over one-quarter of all possible deprivations. The report stresses that poverty levels across states vary significantly, with the incidence of multi-dimensional poverty ranging from a low of 27 per cent in Ondo to a high of 91 per cent in Sokoto. Accordingly, the incidence of monetary poverty is lower than the incidence of MPI across most states. In Nigeria, 40.1 per cent of people had been deemed poor, according to the 2018/19 national monetary poverty line, but 63 per cent have now been regarded as multi-dimensionally poor according to the National MPI 2022.",TRUE,20-01-2023,https://factcheckhub.com/2023-election-fact-checking-peter-obis-claims-at-chatham-house/
Tinubu was the first governor in Nigeria to raise bond for infrastructure and development in Nigeria.,"A bond, according to Investopedia, is a fixed-income instrument that represents a loan made by an investor to a borrower (typically corporate or governmental). A bond could be thought of as an I.O.U. between the lender and borrower, including the loan details and its payments. Bonds are used by companies, states, and sovereign governments to finance projects and operations. Owners of bonds are debt-holders, or creditors, of the issuer. Bond details include the end date when the principal of the loan is due to be paid to the bond owner and usually include the terms for variable or fixed interest payments made by the borrower. The Nigerian Securities and Exchange Commission (SEC) defined a bond as tradable security issued by the borrower (bond issuer) representing a formal agreement to repay the lender (the bondholder) the full amount plus interest over the lifetime of the bond. In Nigeria, a bond may be publicly placed (i.e., listed on an exchange for trading) for trading by the public or maybe a private placement, sold to qualified investors, i.e., institutional investors (like Pension Funds, Banks, etc.) and high net worth individuals. Findings by The ICIR revealed that in 1978, the old Bendel state government headed by Husaini Abdullahi, a military governor took a bond, this preceded Tinubu’s administration in Lagos state. The Bendel State Loan Stock valued at N20 million was taken to develop housing estate in the region. The bond matured in 1988 at a 7 per cent coupon rate. Then, there was a bond taken by the Ogun State Revenue Bond, which took a N15 million, 10-year bond in 1986 for the development of a water project. When the bond was taken, Raji Alagbe Rasaki was the state’s military governor. Between 1987 and 1988, the Lagos State Revenue Bond issued a total sum of N90 million bond for the development of the Lekki Peninsula. Mike Akhigbe was the military governor then. In 1987, the first Oyo State Revenue Bond of N30 million for Adamasingba Shopping Complex and Gbagi Market Development was a 12-year bond. The Kaduna State Revenue Bond took a N60 million bond between 1989 and 1993 for the development of Ginger factory. Abdullahi Sarki Mukhtar and Lawal Jafaru Isa were the military governor and administrators, respectively, within these periods. The Edo State Revenue Bond took a N1 billion bond in 2000 for the development of Ogba Riverside Housing Estate. Lucky Igbinedion was the elected executive governor. The same year, the Delta State Revenue Bond, which took N3.5 billion to develop market, healthcare, water and education in the state. James Ibori was the governor. In 2002, Yobe State Revenue Bond and Ekiti State Revenue Bond took bonds for various developmental projects in their states, respectively. The Lagos State government under Tinubu in 2002 took N15 billion bond through the Lagos State Bond for the refinance of developmental projects in the state. As of February 26, 2015, Lagos State was leading other states with a total of N290.09 billion in bond issuance. The highest was N87.5 billion government Bond – Series 2 under the N167.5 billion debt issuance programme of 2013 for maturity in 2020. The bond raised, which was issued at a 13.5 coupon rate, was meant for infrastructure developments (roads, rail, buildings and bridges etc), health facilities, Adiyan Water Project Phase II construction, and shoreline protection work. Lagos had in 2012 issued a N80 billion bond under the Series 1 of the N167.5 billion debt issuance programme at a 14.5 per cent coupon rate for construction of Adiyan Waterworks (Phase II), infrastructure developments (roads, rail, buildings and bridges etc.), health facilities and redevelopment of Eric Moore Schools (Phase I).",FALSE,13-01-2023,https://factcheckhub.com/fashola-makes-false-claim-that-tinubu-is-the-first-governor-to-raise-infrastructure-bond/
"Visuals show image of Peter Obi on bags of rice branded with PDP logo.
","Checks by The FactCheckHub show that the claim is FALSE. The purported video shows a scene where some bags of rice branded with PDP logo and the names of some contestants under the party were being loaded into a truck. When our researcher did a keyframe analysis of the footage using InVid – a video verification tool, findings show the branded bags of rice had on them names of some PDP candidates who are contesting for various elective positions in Delta state as well as that of Atiku Abubakar and Ifeanyi Okowa, the party’s presidential candidate and his vice, respectively. A clearer pictures of branded bags of rice/ Source: Facebook Names seen on the bags include: Hilary Obioma Igbebulem, secretary to the Delta state governor; Atiku Abubakar, presidential candidate; Ifeanyi Okowa, vice-presidential candidate; Sheriff Oborevwori, PDP governorship candidate in Delta state, Ned Nwoko, Delta North senatorial candidate, Victor Nwokolo, representing Ika Federal Constituency and Marilyn Okowa, a contestant for Delta state House of Assembly. Further checks online revealed a clearer image of the packaged rice. Findings revealed that the image seen on the branded bags of rice is that of Hilary Obioma Igbebulem, the principal secretary to the Delta State governor who reportedly sponsored or bought the items and not Peter Obi as claimed in the viral social media posts. Another clearer image showing the bags of rice",FALSE,03-01-2023,https://factcheckhub.com/image-on-branded-bags-of-rice-shows-pdp-chieftain-not-peter-obi/
Video shows Governor Wike leading a campaign rally for Peter Obi in Port Harcourt.,"Findings by The FactCheckHub show that the claim is FALSE. The viral video was traced to the TikTok post made on Thursday, November 17, 2022, the same day Peter Obi and his running mate, Datti Baba-Ahmed visited Port Harcourt to commission a project for the Rivers State Governor, Nyesome Wike, who is a member of the Peoples Democratic Party (PDP). Wike had in November invited Obi to the state capital for the commissioning of the 9th flyover by his administration. Screenshot of the news footage showing the moment Wike and Obi arrived the event venue to commission a flyover in Port Harcourt, Rivers state on November 17, 2022. CREDITS: TVC News. Checks revealed that the viral video show the moment the former governor of Anambra state alongside his running mate was received by a large crowd of his supporters at the venue of the Nkpolu – Oroworukwo flyover inauguration. A footage of their arrival at the event’s venue uploaded on YouTube by TVC News Nigeria shows people with PDP flags at the venue of the project inauguration. Channels Television and other media platforms also reported the event. My team and I just arrived at the Government House in Port Harcourt, Rivers State, for the Commissioning of a new Flyover constructed by HE @GovWike. -PO pic.twitter.com/u3tI1h6reG — Peter Obi (@PeterObi) November 17, 2022 That was not the first time Governor Wike would invite a member of an opposition party for project commissioning in Rivers State. He had earlier invited the current Nigeria’s Vice President, Yemi Osinbajo, Speaker of the Federal House of Representatives, Femi Gbajabiamila, and a former Edo state governor, Adams Oshiomole, who were all members of the All Progressives Congress (APC) to commission some of the projects executed by his administration. Wike also invited the presidential candidate of the New Nigeria Peoples Party (NNPP), Rabiu Musa Kwankwaso, to inaugurate Mgbutanwo Internal Roads in Emohua Local Government Area of Rivers State.",FALSE,23-12-2022,https://factcheckhub.com/video-does-not-show-governor-wike-leading-campaign-rally-for-peter-obi/
"Nigeria has about 300,000 policemen.","Findings by The FactCheckHub show that the claim is FALSE. An analysis published by Dataphyte on October 7, 2019 showed that the population of the Nigeria Police Force (NPF) was at 371,800, with police to population ratio of one police officer to five hundred and forty (540) citizens. According to INTERPOL, the strength of the Nigeria Police Force is more than 350,000 men and women across the 36 states and the FCT. Also, a security expert, Bola Bakare stated in a report published by the Vanguard on July 7, 2021 that the personnel strength of the Nigeria Police Force stood at 370,000.",FALSE,18-12-2022,https://factcheckhub.com/fact-checking-nasir-el-rufais-claims-about-nigerian-military-size-others-at-chatham-house/
Peter Obi claimed that over 130 million live in poverty in Nigeria.,"According to a recent report by the National Bureau of Statistics (NBS) on multi-dimensional poverty, about 133 million people in the country, representing 63 per cent of the population, are living in different categories of poverty. The report stated that 65 per cent of the poor (86 million people) live in the North, while 35 per cent (nearly 47 million) live in the South. The National Multi-Dimensional Poverty Index (MPI) report is 0.257, indicating that poor people in Nigeria experience just over one-quarter of all possible deprivations. The report stresses that poverty levels across states vary significantly, with the incidence of multi-dimensional poverty ranging from a low of 27 per cent in Ondo to a high of 91 per cent in Sokoto. According to the report, over half of the population of Nigeria are multi-dimensionally poor and cook with dung, wood or charcoal, rather than with cleaner energy. According to the report, high deprivations are also apparent nationally in sanitation, healthcare, food insecurity, and housing. Accordingly, the incidence of monetary poverty is lower than the incidence of MPI across most states. In Nigeria, 40.1 per cent of people had been deemed poor, according to the 2018/19 national monetary poverty line, but 63 per cent have now been regarded multi-dimensionally poor according to the National MPI 2022.",TRUE,25-11-2022,https://factcheckhub.com/fact-checking-obis-claims-at-the-candidates-presidential-town-hall-series/
Kwankwaso claimed that he never borrowed money when he was governor of Kano state. ,"According to a report by Premium Times, Kano state Commissioner of Information, Mohammed Garba, said that Kwankwaso borrowed N4.161 billion from pensioners’ funds to build Bandirawo and Amana Housing Estates. He added that when the project was completed, the government realized pensioners could not afford housing units in the estates because of the cost. In a Vanguard report in 2021, the former Kano governor was probed by the EFCC for allegedly mismanaging N10 billion in pension remittances between 2011 and 2015.",FALSE,22-11-2022,https://factcheckhub.com/fact-checking-kwankwasos-claims-at-the-candidates-presidential-town-hall-series/
Obasanjo’s administration spent $16 billion dollars on the power sector – Sowore.,"There were allegations that President Olusegun Obasanjo’s administration spent $16 billion on power projects. However, there are no publicly available official records that prove this. Some members of the Obasanjo administration have refuted the claim. Also, a 2017 report on corruption in the power sector by the Socio-Economic Rights and Accountability Project (SERAP) records that Obasanjo’s administration spent $10 billion, not $16 billion on NIPP from the testimony of the former President’s Chief Economic Adviser, Taminu Yakubu, while testifying before the Senate probe committee. Similarly, a breakdown published by the Vanguard shows that the Federal Government released a total sum of N374.65 billion or $2.9 billion to the Ministry of Power between 1999 to 2006 under Obasanjo’s regime. According to the Vanguard, the breakdown was part of the report presented by the former Permanent Secretary, Ministry of Power, Godknows Igali, and the Managing Director, Niger Delta Power Holding Company, NDPHC, James Olotu, before a Senate Ad-hoc Committee probing the power sector from 1999 to 2015.",FALSE,19-11-2022,https://factcheckhub.com/fact-checking-sowores-claims-at-the-candidates-presidential-town-hall-series/
Wike defects to APC.,"Findings by The FactCheckHub show that the claim is FALSE. Checks using keyword searches online show that the video had surfaced online with similar claims around June 2022 after the PDP presidential primary election. Analysis of the video shows that it was cut from Wike’s interview with Arise TV broadcast on July 2021. In the original video, Wike was reacting to the defection of some governors and legislators from the PDP to the ruling APC. Prior to the interview, PDP had lost three governors and other party members to the APC in the space of seven months. The River State governor responded to the question by the Arise TV anchor, Oseni Rufai, who asked if the reason members of the party, especially from the South-East, were leaving the party was because the party did not consider zoning. In the full video (29:00-32:00 minutes), Wike argued that the defectors could not justify their reasons for leaving the party. He added that their reasons should be in the interest of their people and their region and not because of their political relevance. “What makes you a man is to be able to tell your people a simple truth,” Wike said. Citing an instance, he said in the 57 minutes video: “I am leaving PDP to APC today because PDP have not done anything for South-South, PDP have not done anything in Rivers State, PDP have not done anything for my people. I would catalogue everything. I’m leaving PDP to APC. See the reasons why I’m leaving PDP to join you. Tell me, are you willing to do all these things that PDP didn’t do for me….” Meanwhile, Kelvin Ebiri, the Media Aide to Wike, had in June 2022 debunked the viral video, adding that it should be disregarded.",FALSE,04-11-2022,https://factcheckhub.com/false-claim-that-nyesom-wike-has-defected-to-apc-resurfaces-online/
That Obi said he pulled 439 million people out of poverty in Anambra.,"Findings by The FactCheckHub show that the claim is FALSE. Further checks by The FactCheckHub revealed that the video has been manipulated. Where Obi mentioned “China” was removed and replaced with where he said “I” as seen in the doctored video. In the full original video, Obi spoke about how the adoption of the Millenium Development Goals helped China to lift 439 million citizens out of poverty. “….It was MDGs China input into their development agenda and were able to pull 439 million people out of poverty. It was MDGs India input into their development agenda, and they were able to pull 269 million people out of poverty,” Obi said.",FALSE,25-10-2022,https://factcheckhub.com/claim-that-obi-said-he-pulled-439-million-people-out-of-poverty-is-false/
That photo shows Bola Tinubu watching Peter Obi on television.,"Findings by The FactCheckHub show that the claim is FALSE. Using Google Reverse Image Search, checks revealed that the photo has been manipulated. The original photo shows Bola Tinubu staring at a TV screen. The original image shows Tinubu in an aeroplane staring at a TV screen on his way from the United Kingdom to Nigeria. However, there was nothing showing on the screen. This is not the first time that Charly Boy has shared misleading claims online. The FactCheckHub had earlier reported how he shared a misleading video with a claim that it shows Peter Obi’s supporters in boats holding a campaign rally in riverine areas. When The FactCheckHub subjected the video to verification, it revealed that the claim was FALSE. The FactCheckHub also reported how he made a false claim about the electronic transmission of election results by the Independent National Electoral Commission (INEC).",MISLEADING,10-10-2022,https://factcheckhub.com/charly-boy-shares-misleading-photo-of-tinubu-watching-peter-obi-on-tv/
"Claim that the video shows Tinubu’s workout session at his London home on October 3, 2022.","Findings by The FactCheckHub show that the claim is MISLEADING. A keyword search on the veracity of the claim revealed that the video has been on the internet for over 9 years, precisely since 2013 and NOT in October 2022. The video was uploaded on YouTube by one Gbenga Olorunpomi on September 22, 2013. The caption to the video read: “Asiwaju Bola Tinubu getting his fitness back.” The video was also traced to a discussion thread on Nairaland where the video was posted on September 23, 2013. The topic of the thread reads, “Bola Tinubu shows off on exercise bike to confirm he is well.” Reports indicated that the footage was released to prove the healthy fitness status of Bola Tinubu following the speculations that he was sick at the time. The FactCheckHub had earlier published a series of tutorials on verifying video claims and viral images, including how to verify visuals using frames and how to fact-check viral posts shared via WhatsApp, among others. It has also posted media literacy articles on how netizens can avoid falling victim to false and misleading information.",MISLEADING,06-10-2022,https://factcheckhub.com/old-video-of-tinubu-working-out-goes-viral-with-misleading-claim/
Claim that Tinubu never spent more than two weeks outside Nigeria.,"Findings by The FactCheckHub show that the claim is FALSE. Checks revealed that Tinubu spent three months in London, the United Kingdom, in 2021. According to a statement by his media office, the former governor had surgery on his right knee and underwent physiotherapy following the operation. He spent weeks recuperating, and during that period, he was visited by dignitaries from Nigeria, including President Muhammadu Buhari and some governors such as Babajide Sanwo-Olu (Lagos), Umar Ganduje (Kano), Dapo Abiodun (Ogun), Kayode Fayemi (Ekiti), and Rotimi Akeredolu (Ondo), The Punch reported.",FALSE,06-10-2022,https://factcheckhub.com/claim-by-lagos-apc-women-leader-that-tinubu-never-spent-more-than-two-weeks-abroad-is-false/
ACN fielded a Muslim-Muslim ticket in 2011.,"Findings by The FactCheckHub show that the claim is TRUE. The Action Congress of Nigeria fielded Nuhu Ribadu, a former Chairman of the Economic and Financial Crimes Commission and Fola Adeola, a co-founder of Guaranty Trust Bank (GTBank), as the presidential and vice-presidential candidates of the party, respectively in 2011. Checks show that they are both Muslims. Reports show that Christian groups canvassed support for Ribadu’s gubernatorial candidacy in Adamawa state in the 2015 election whom they acknowledged was a Muslim. Ribadu also felicitated with fellow Muslims during Ramadan in 2020 via his tweet. According to his biography published by the entrepreneurs.ng, Fola Adeola was referred to as Tajudeen, which is a Muslim name. His wife is Hajara Adeola, who is also a Muslim. The FactCheckHub also found one of his tweets where he responded to a tweet acknowledging that he’s a Muslim.",TRUE,03-10-2022,https://factcheckhub.com/fact-checking-keyamos-claims-on-muslim-muslim-ticket-percentage-of-votes-won-by-atiku-in-2019/
